filename,name,email,phone,summary,skills,education,experience,projects,research,relevant_classwork,Response ID,got_internship,text
R_2EiyvsYvz22jsW5_Resume-03-2019.pdf,Debrian Figueroa,debrianfigueroa@gmail.com,(786) 286-6283,,"English, Spanish, Ionic, Angular, Google Firebase, Android Studios, Github, Wordpress","[{""school"": ""University of Florida"", ""degree"": null, ""GPA"": null, ""year"": ""Aug 2016-Present""}]","[{""title"": ""Engineering Practicum Intern"", ""company"": ""Google"", ""dates"": ""May 2018-Aug 2018"", ""bullets"": [""Developed features for an internal Android UI automation testing tool."", ""Improved user cooperation and increased test development speed by creating an interface that easily allows users to share and distribute the tests they have made."", ""Added new feature that allowed searching for and investigating UI components on a device, which is very useful for debugging purposes."", ""Participated in the full development workflow, which included writing design docs, getting them reviewed, creating the features, improving and iterating on the features, and launching."", ""Handled full stack development, using Java, SQL for the backend, and Angular for the front-end.""]}, {""title"": ""Information Technology Intern"", ""company"": ""Layer 8 Solutions"", ""dates"": ""Summer of 2016/2017"", ""bullets"": [""Troubleshooted basic computer issues for school employees."", ""Handled the setup and maintenance of the school computers, including Ghosting them for the new school year.""]}]","[{""name"": ""Scribble"", ""description"": ""Cross-platform note sharing application made with the Ionic Framework. The app merges the users’ individual notes into a collective note shared among them. This was a two-person project. My role included setting up everything involved with Firebase Database, as well as helping with the general design of the product.""}, {""name"": ""Food Planner"", ""description"": ""An Android-based mobile application developed using Android Studio, which I made on my own to help my family with their meal planning. This application helps families schedule their breakfast, lunch and dinner for the week through an intuitive display and real-time sync across all the members that own the application.""}]",[],,R_2EiyvsYvz22jsW5,1," English, Spanish, Ionic, Angular, Google Firebase, Android Studios, Github, Wordpress [{""title"": ""Engineering Practicum Intern"", ""company"": ""Google"", ""dates"": ""May 2018-Aug 2018"", ""bullets"": [""Developed features for an internal Android UI automation testing tool."", ""Improved user cooperation and increased test development speed by creating an interface that easily allows users to share and distribute the tests they have made."", ""Added new feature that allowed searching for and investigating UI components on a device, which is very useful for debugging purposes."", ""Participated in the full development workflow, which included writing design docs, getting them reviewed, creating the features, improving and iterating on the features, and launching."", ""Handled full stack development, using Java, SQL for the backend, and Angular for the front-end.""]}, {""title"": ""Information Technology Intern"", ""company"": ""Layer 8 Solutions"", ""dates"": ""Summer of 2016/2017"", ""bullets"": [""Troubleshooted basic computer issues for school employees."", ""Handled the setup and maintenance of the school computers, including Ghosting them for the new school year.""]}] [{""name"": ""Scribble"", ""description"": ""Cross-platform note sharing application made with the Ionic Framework. The app merges the users’ individual notes into a collective note shared among them. This was a two-person project. My role included setting up everything involved with Firebase Database, as well as helping with the general design of the product.""}, {""name"": ""Food Planner"", ""description"": ""An Android-based mobile application developed using Android Studio, which I made on my own to help my family with their meal planning. This application helps families schedule their breakfast, lunch and dinner for the week through an intuitive display and real-time sync across all the members that own the application.""}] [{""school"": ""University of Florida"", ""degree"": null, ""GPA"": null, ""year"": ""Aug 2016-Present""}] [] "
R_2EmyGzAXJ60aFzu_ArielCoulsonResume.pdf,Ariel Coulson,arielcoulson@ufl.edu,(954) 439-5822,,"Java, C++, JavaScript, SQL, HTML, MATLAB, AngularJS, Microsoft Office, Adobe Photoshop, InDesign, Dreamweaver","[{""school"": ""University of Florida"", ""degree"": ""BS Computer Science"", ""GPA"": ""3.7"", ""year"": ""May 2020""}]",[],"[{""name"": ""Gaming Gators"", ""description"": ""Created an application to host gaming events in the Gainesville area. Served as a front-end developer on a team of five individuals. Skills: HTML, CSS, AngularJS, Node.js, and Javascript""}, {""name"": ""Huffman Tree Project"", ""description"": ""Created a huffman tree to encode and decode character frequencies using Java.""}, {""name"": ""Player versus Computer Blackjack Game"", ""description"": ""Used C++ to create an interactive blackjack game. Also, calculated the probability of a player winning.""}, {""name"": ""Art Website"", ""description"": ""Used CSS, HTML, and Adobe Dreamweaver to create a visually pleasing website for a local art company.""}]",[],"Programming Fundamentals 1 & 2, Introduction to Software Engineering (MEAN stack), Data Structures and Algorithms, Computer Organization, Discrete Structures, Computational Linear Algebra, Database Systems 1 (SQL), Professional Communication for Engineers, Engineering Physics 1 & 2, Engineering Calculus 1, 2, and 3",R_2EmyGzAXJ60aFzu,1," Java, C++, JavaScript, SQL, HTML, MATLAB, AngularJS, Microsoft Office, Adobe Photoshop, InDesign, Dreamweaver [] [{""name"": ""Gaming Gators"", ""description"": ""Created an application to host gaming events in the Gainesville area. Served as a front-end developer on a team of five individuals. Skills: HTML, CSS, AngularJS, Node.js, and Javascript""}, {""name"": ""Huffman Tree Project"", ""description"": ""Created a huffman tree to encode and decode character frequencies using Java.""}, {""name"": ""Player versus Computer Blackjack Game"", ""description"": ""Used C++ to create an interactive blackjack game. Also, calculated the probability of a player winning.""}, {""name"": ""Art Website"", ""description"": ""Used CSS, HTML, and Adobe Dreamweaver to create a visually pleasing website for a local art company.""}] [{""school"": ""University of Florida"", ""degree"": ""BS Computer Science"", ""GPA"": ""3.7"", ""year"": ""May 2020""}] [] Programming Fundamentals 1 & 2, Introduction to Software Engineering (MEAN stack), Data Structures and Algorithms, Computer Organization, Discrete Structures, Computational Linear Algebra, Database Systems 1 (SQL), Professional Communication for Engineers, Engineering Physics 1 & 2, Engineering Calculus 1, 2, and 3"
R_2OI4qi3qazy5bgU_JonathanBishopResume.pdf,Jonathan S. Bishop,jsbishop@ufl.edu,727-773-6530,"A computer engineering student with both hardware and software skills, seeking a position involving a mix of software and hardware design in a fun, fast paced environment.","C++, Java, MATLAB, JavaScript, HTML, CSS, Linux, Android, Windows, Mongo DB, Angular, Eclipse, Visual Studio, Qt, Ethernet networking, Discrete logic design, Microprocessor circuits, Device drivers, PowerPoint, Audio, video, Music composition, Excellent writer, Multimedia presentations","[{""school"": ""University of Florida"", ""degree"": ""Bachelor of Science, Computer Engineering"", ""GPA"": ""3.3"", ""year"": ""May 2020""}]","[{""title"": ""Pit Display"", ""company"": ""Solar Gators racing team"", ""dates"": ""Fall 2018 / Spring 2019"", ""bullets"": [""Created GUI for pit crew to view real-time telemetry data from the solar racing vehicle"", ""Implemented Qt-based interface using C++ to access serial communication and display data real-time""]}, {""title"": ""Online Database"", ""company"": ""Software Engineering Group Project"", ""dates"": ""Spring 2019"", ""bullets"": [""Implemented solution for real-world client website application matching tutors with students"", ""Created HTML user input forms and JavaScript controller functions for user profile data"", ""Created Mongo DB database schema for use with online database of website users""]}, {""title"": ""Linux OS Applications"", ""company"": ""Operating System Class projects"", ""dates"": null, ""bullets"": [""Implemented Ubuntu kernel modifications for custom file read/write capability"", ""Implemented interface between Android OS and the underlying Ubuntu kernel"", ""Implemented user-space USB device driver for custom joystick controller"", ""Implemented process communication using pipes, sockets, FIFOs""]}, {""title"": ""Vision system intern"", ""company"": ""Harvest CROO Robotics"", ""dates"": ""Summer 2018"", ""bullets"": [""Implemented Qt-based visual truthing software GUI to allow creation of truth database of berry images"", ""Created software for analyzing accuracy of berry detection software""]}]",[],[],,R_2OI4qi3qazy5bgU,1,"A computer engineering student with both hardware and software skills, seeking a position involving a mix of software and hardware design in a fun, fast paced environment. C++, Java, MATLAB, JavaScript, HTML, CSS, Linux, Android, Windows, Mongo DB, Angular, Eclipse, Visual Studio, Qt, Ethernet networking, Discrete logic design, Microprocessor circuits, Device drivers, PowerPoint, Audio, video, Music composition, Excellent writer, Multimedia presentations [{""title"": ""Pit Display"", ""company"": ""Solar Gators racing team"", ""dates"": ""Fall 2018 / Spring 2019"", ""bullets"": [""Created GUI for pit crew to view real-time telemetry data from the solar racing vehicle"", ""Implemented Qt-based interface using C++ to access serial communication and display data real-time""]}, {""title"": ""Online Database"", ""company"": ""Software Engineering Group Project"", ""dates"": ""Spring 2019"", ""bullets"": [""Implemented solution for real-world client website application matching tutors with students"", ""Created HTML user input forms and JavaScript controller functions for user profile data"", ""Created Mongo DB database schema for use with online database of website users""]}, {""title"": ""Linux OS Applications"", ""company"": ""Operating System Class projects"", ""dates"": null, ""bullets"": [""Implemented Ubuntu kernel modifications for custom file read/write capability"", ""Implemented interface between Android OS and the underlying Ubuntu kernel"", ""Implemented user-space USB device driver for custom joystick controller"", ""Implemented process communication using pipes, sockets, FIFOs""]}, {""title"": ""Vision system intern"", ""company"": ""Harvest CROO Robotics"", ""dates"": ""Summer 2018"", ""bullets"": [""Implemented Qt-based visual truthing software GUI to allow creation of truth database of berry images"", ""Created software for analyzing accuracy of berry detection software""]}] [] [{""school"": ""University of Florida"", ""degree"": ""Bachelor of Science, Computer Engineering"", ""GPA"": ""3.3"", ""year"": ""May 2020""}] [] "
R_2PckCQEevhFtqL0_Olivia Yang Resume.pdf,Olivia Yang,Olivia.yang@ufl.edu,(239)-287-8175,,"MS Office proficient, Bilingual in Chinese and English, Energetic caregiver, Adapts quickly, Time management, Creative, Detail-oriented","[{""school"": ""University of Florida"", ""degree"": null, ""GPA"": ""3.83"", ""year"": ""2017-current""}, {""school"": ""Fort Myers High School"", ""degree"": ""High School Diploma"", ""GPA"": ""5.6"", ""year"": ""2013-2017""}]","[{""title"": ""Survey Researcher Student Assistant"", ""company"": ""UF Survey Research Center"", ""dates"": ""07/2017—04/2018"", ""bullets"": [""Conducted and administered surveys for numerous business and medical companies""]}, {""title"": ""Special Olympics Volunteer"", ""company"": ""Balance 180"", ""dates"": ""08/2018—current"", ""bullets"": [""Assisted and coached children with disabilities in various sports and activities""]}, {""title"": ""Volunteer Food Delivery"", ""company"": ""Golisano Children’s Hospital of Southwest Florida"", ""dates"": ""06/2015 – 08/2015"", ""bullets"": [""Addressed diner complaints with kitchen staff and served replacement menu items promptly.""]}, {""title"": ""Volunteer Waiting Room"", ""company"": ""Golisano Children’s Hospital of Southwest Florida"", ""dates"": ""06/2016 – 08/2016"", ""bullets"": [""Entertained and supervised children while they waited for procedures""]}, {""title"": ""Lab Core Volunteer"", ""company"": ""Shands Hospital"", ""dates"": ""01/2018-05/2018"", ""bullets"": [""Cleaned and organized test tubes"", ""Sent specimen to designated locations""]}, {""title"": ""Nurse’s Assistant"", ""company"": ""Shands Heart and NeuroHospital"", ""dates"": ""08/2018—12/2018"", ""bullets"": [""Restocked medical supplies in patient rooms"", ""Delivered water to patients"", ""Handled various clerical tasks""]}, {""title"": ""Cashier"", ""company"": ""Panera Bread"", ""dates"": ""02/2017 – 06/2017"", ""bullets"": [""Operated a cash register for cash, check, and credit card transactions"", ""Stocked and replenished merchandise according to store merchandising layouts"", ""Trained new cashiers.""]}]",[],[],,R_2PckCQEevhFtqL0,0," MS Office proficient, Bilingual in Chinese and English, Energetic caregiver, Adapts quickly, Time management, Creative, Detail-oriented [{""title"": ""Survey Researcher Student Assistant"", ""company"": ""UF Survey Research Center"", ""dates"": ""07/2017—04/2018"", ""bullets"": [""Conducted and administered surveys for numerous business and medical companies""]}, {""title"": ""Special Olympics Volunteer"", ""company"": ""Balance 180"", ""dates"": ""08/2018—current"", ""bullets"": [""Assisted and coached children with disabilities in various sports and activities""]}, {""title"": ""Volunteer Food Delivery"", ""company"": ""Golisano Children’s Hospital of Southwest Florida"", ""dates"": ""06/2015 – 08/2015"", ""bullets"": [""Addressed diner complaints with kitchen staff and served replacement menu items promptly.""]}, {""title"": ""Volunteer Waiting Room"", ""company"": ""Golisano Children’s Hospital of Southwest Florida"", ""dates"": ""06/2016 – 08/2016"", ""bullets"": [""Entertained and supervised children while they waited for procedures""]}, {""title"": ""Lab Core Volunteer"", ""company"": ""Shands Hospital"", ""dates"": ""01/2018-05/2018"", ""bullets"": [""Cleaned and organized test tubes"", ""Sent specimen to designated locations""]}, {""title"": ""Nurse’s Assistant"", ""company"": ""Shands Heart and NeuroHospital"", ""dates"": ""08/2018—12/2018"", ""bullets"": [""Restocked medical supplies in patient rooms"", ""Delivered water to patients"", ""Handled various clerical tasks""]}, {""title"": ""Cashier"", ""company"": ""Panera Bread"", ""dates"": ""02/2017 – 06/2017"", ""bullets"": [""Operated a cash register for cash, check, and credit card transactions"", ""Stocked and replenished merchandise according to store merchandising layouts"", ""Trained new cashiers.""]}] [] [{""school"": ""University of Florida"", ""degree"": null, ""GPA"": ""3.83"", ""year"": ""2017-current""}, {""school"": ""Fort Myers High School"", ""degree"": ""High School Diploma"", ""GPA"": ""5.6"", ""year"": ""2013-2017""}] [] "
R_2Pdtbf5Qp3n81Yr_Remee Agbayani.pdf,Remee Agbayani,remeeliz@gmail.com,808-371-0470,"Seeking a position with a company where I can grow and utilize my innovative thinking, problem solving skills, and technology knowledge to support the company’s growth and goals.","C#, asp.net, C++, Java, TSQL, HTML 5, CSS, PowerShell, SQL Server 2005, SQL Server 2008, SQL Server 2012, SQL Server 2016, Oracle, Excel, Word, Access, PowerPoint, Photoshop, Acrobat, Dreamweaver, QuickBooks, Solomon, MAS90, MAS200, Megasys, SSIS, SSRS, PCI, SOC, MySQL, Visual Studio","[{""school"": ""UNIVERSITY OF FLORIDA"", ""degree"": ""BACHELOR OF SCIENCE"", ""GPA"": null, ""year"": ""MAY 2019""}, {""school"": ""UNIVERSITY OF HAWAII KCC"", ""degree"": ""ACCOUNTING ASSOCIATES OF SCIENCE"", ""GPA"": null, ""year"": ""MAY 2013""}]","[{""title"": ""MSSQL DBA"", ""company"": ""INTUITION LLC"", ""dates"": ""NOVEMBER 2016 - PRESENT"", ""bullets"": [""SQL Server 2014/2016 DBA – Configure & Build SQL Instances (Including SSIS & SSRS). Manage 36 SQL 2008,12,14,16 instances. Ensure high availability."", ""Create automation of database maintenance jobs through PowerShell, SQLCMD, Visual Studio."", ""Ensure database and servers are PCI & SOC audit compliant."", ""Write standard operating procedures and ensure change policy is adhered to."", ""Code review & performance troubleshooting (index tuning & query optimization)"", ""Develop internal applications to simplify processes.""]}, {""title"": ""DEVELOPER / MSSQL DBA"", ""company"": ""MICHAEL WAYNE INVESTMENT"", ""dates"": ""JUNE 2015 – DECEMBER 2017"", ""bullets"": [""SQL Server 2014 DBA – managing data import, backup, compression, security, building databases, writing stored procedures, creating packages to convert MySQL to TSQL, initial SQL Server setup."", ""Developed and implemented user interface for indirect lending, to manage new applications, dealers, and credit reports merged application to work with outside vendor."", ""Create and maintain financial, collector performance, call tracking web reporting with C#"", ""Frontend & Backend web development.""]}, {""title"": ""JUNIOR BUSINESS ANALYST"", ""company"": ""COASTAL CREDIT"", ""dates"": ""OCTOBER 2013 – JUNE 2015"", ""bullets"": [""Creating plans, monitoring schedule, requirement documentation, and documenting IT projects."", ""Create and manage databases, generate and create ad hoc reports with TSQL and Visual Studio"", ""Working with excel to create accounting reports and bonus sheets using macro, pivot tables, and formulas.""]}]",[],[],,R_2Pdtbf5Qp3n81Yr,0,"Seeking a position with a company where I can grow and utilize my innovative thinking, problem solving skills, and technology knowledge to support the company’s growth and goals. C#, asp.net, C++, Java, TSQL, HTML 5, CSS, PowerShell, SQL Server 2005, SQL Server 2008, SQL Server 2012, SQL Server 2016, Oracle, Excel, Word, Access, PowerPoint, Photoshop, Acrobat, Dreamweaver, QuickBooks, Solomon, MAS90, MAS200, Megasys, SSIS, SSRS, PCI, SOC, MySQL, Visual Studio [{""title"": ""MSSQL DBA"", ""company"": ""INTUITION LLC"", ""dates"": ""NOVEMBER 2016 - PRESENT"", ""bullets"": [""SQL Server 2014/2016 DBA – Configure & Build SQL Instances (Including SSIS & SSRS). Manage 36 SQL 2008,12,14,16 instances. Ensure high availability."", ""Create automation of database maintenance jobs through PowerShell, SQLCMD, Visual Studio."", ""Ensure database and servers are PCI & SOC audit compliant."", ""Write standard operating procedures and ensure change policy is adhered to."", ""Code review & performance troubleshooting (index tuning & query optimization)"", ""Develop internal applications to simplify processes.""]}, {""title"": ""DEVELOPER / MSSQL DBA"", ""company"": ""MICHAEL WAYNE INVESTMENT"", ""dates"": ""JUNE 2015 – DECEMBER 2017"", ""bullets"": [""SQL Server 2014 DBA – managing data import, backup, compression, security, building databases, writing stored procedures, creating packages to convert MySQL to TSQL, initial SQL Server setup."", ""Developed and implemented user interface for indirect lending, to manage new applications, dealers, and credit reports merged application to work with outside vendor."", ""Create and maintain financial, collector performance, call tracking web reporting with C#"", ""Frontend & Backend web development.""]}, {""title"": ""JUNIOR BUSINESS ANALYST"", ""company"": ""COASTAL CREDIT"", ""dates"": ""OCTOBER 2013 – JUNE 2015"", ""bullets"": [""Creating plans, monitoring schedule, requirement documentation, and documenting IT projects."", ""Create and manage databases, generate and create ad hoc reports with TSQL and Visual Studio"", ""Working with excel to create accounting reports and bonus sheets using macro, pivot tables, and formulas.""]}] [] [{""school"": ""UNIVERSITY OF FLORIDA"", ""degree"": ""BACHELOR OF SCIENCE"", ""GPA"": null, ""year"": ""MAY 2019""}, {""school"": ""UNIVERSITY OF HAWAII KCC"", ""degree"": ""ACCOUNTING ASSOCIATES OF SCIENCE"", ""GPA"": null, ""year"": ""MAY 2013""}] [] "
