filename,name,email,phone,summary,skills,education,experience,projects,research,relevant_classwork,Response ID,got_internship,text
R_3D2aahVeub8Fj8L_Navid Ghomeshi Resume 2019.pdf,Navid Ghomeshi,nghomeshi@ufl.edu,954 304-7687,Innovator/Thinker,"Javascript, HTML, CSS, Node.JS, Angular.JS, SQL, Excel, Java, C++, Wix, C, Arduino, 3D Printing","[{""school"": ""University of Florida"", ""degree"": ""Computer Science"", ""GPA"": ""3.40"", ""year"": ""Fall 2019""}]","[{""title"": ""Accenture Innovation Challenge"", ""company"": ""Accenture"", ""dates"": ""Spring 2018"", ""bullets"": [""Worked with 3 forward-thinking students and Accenture employees to optimize CARE USA’s She Feeds The World program"", ""Strategized a sustainable solution increasing access to income and markets, providing an integrated approach improving food and nutrition security""]}, {""title"": ""Technology Intern"", ""company"": ""CourtVision International"", ""dates"": ""Summer 2017"", ""bullets"": [""Devised plan to use 360°cameras and VR goggles to immerse participants in a classroom-like setting allowing multiple parties to communicate in a virtual manner"", ""Restructured functionality of website using Wix to yield higher global awareness of the organization’s citizen diplomacy and conflict resolution efforts""]}, {""title"": ""Product Development Intern"", ""company"": ""360Fly"", ""dates"": ""Summer 2014 & 2015"", ""bullets"": [""Broadened usability of alert safety consumer product (V.ALRT), creating new proprietary technology"", ""Conducted high level market analysis for 360Fly consumer products"", ""Coordinated strategies to approach suitable markets, personally generated over $10,000 in sales by representing company at the Miami International Boat Show"", ""Controlled social media outlets and produced content for thousands of followers""]}, {""title"": ""Computer Engineering Intern"", ""company"": ""Google/Motorola Mobility"", ""dates"": ""Summer 2013"", ""bullets"": [""Designed and implemented motorized gimbal for Moto X sensor calibration"", ""Programmed the motorized sensor with C, using Arduino electronic platform"", ""Designed and built components with 3D printing machines to produce custom units"", ""Built a capacitive response system for easier internal beta testing analyzation""]}]","[{""name"": ""Find-My-TA"", ""description"": ""Web application for instructors to share office hours/location""}, {""name"": ""Stock Beta Analysis"", ""description"": ""C++ application to calculate Beta values of stocks allowing for better assessment of volatility""}]",[],"Web App Development, Database Systems, Data Structures",R_3D2aahVeub8Fj8L,1,"Innovator/Thinker Javascript, HTML, CSS, Node.JS, Angular.JS, SQL, Excel, Java, C++, Wix, C, Arduino, 3D Printing [{""title"": ""Accenture Innovation Challenge"", ""company"": ""Accenture"", ""dates"": ""Spring 2018"", ""bullets"": [""Worked with 3 forward-thinking students and Accenture employees to optimize CARE USA’s She Feeds The World program"", ""Strategized a sustainable solution increasing access to income and markets, providing an integrated approach improving food and nutrition security""]}, {""title"": ""Technology Intern"", ""company"": ""CourtVision International"", ""dates"": ""Summer 2017"", ""bullets"": [""Devised plan to use 360°cameras and VR goggles to immerse participants in a classroom-like setting allowing multiple parties to communicate in a virtual manner"", ""Restructured functionality of website using Wix to yield higher global awareness of the organization’s citizen diplomacy and conflict resolution efforts""]}, {""title"": ""Product Development Intern"", ""company"": ""360Fly"", ""dates"": ""Summer 2014 & 2015"", ""bullets"": [""Broadened usability of alert safety consumer product (V.ALRT), creating new proprietary technology"", ""Conducted high level market analysis for 360Fly consumer products"", ""Coordinated strategies to approach suitable markets, personally generated over $10,000 in sales by representing company at the Miami International Boat Show"", ""Controlled social media outlets and produced content for thousands of followers""]}, {""title"": ""Computer Engineering Intern"", ""company"": ""Google/Motorola Mobility"", ""dates"": ""Summer 2013"", ""bullets"": [""Designed and implemented motorized gimbal for Moto X sensor calibration"", ""Programmed the motorized sensor with C, using Arduino electronic platform"", ""Designed and built components with 3D printing machines to produce custom units"", ""Built a capacitive response system for easier internal beta testing analyzation""]}] [{""name"": ""Find-My-TA"", ""description"": ""Web application for instructors to share office hours/location""}, {""name"": ""Stock Beta Analysis"", ""description"": ""C++ application to calculate Beta values of stocks allowing for better assessment of volatility""}] [{""school"": ""University of Florida"", ""degree"": ""Computer Science"", ""GPA"": ""3.40"", ""year"": ""Fall 2019""}] [] Web App Development, Database Systems, Data Structures"
R_3CW1xPyNICb3Ig0_2018 Resume.pdf,Sara Marigomen,saramarigomen@gmail.com,(407) 462 - 6686,,"Adobe Photoshop, Certified, Energetic, Organized, Basic Java, C++, HTML, CSS, Proficient in Adobe InDesign, Detail-oriented, Computer Literate","[{""school"": ""University of Florida"", ""degree"": ""College of Engineering - Digital Arts and Sciences"", ""GPA"": ""3.39"", ""year"": ""MAY 2020""}]","[{""title"": ""Student Assistant"", ""company"": ""UF Student Government"", ""dates"": ""JULY 2018 - PRESENT"", ""bullets"": [""Greets and assists visitors and directors"", ""Provides service and information to visitors, callers, and staff""]}, {""title"": ""Server"", ""company"": ""Stage 7 Karaoke & Bar"", ""dates"": ""JUNE 2017 - MARCH 2018"", ""bullets"": [""Provided customer services, such as setting up the karaoke machines and serving food"", ""Handled customer reception and monetary transactions at the cash register"", ""Organized the storage rooms, karaoke rooms, and the front bar""]}, {""title"": ""Bookseller"", ""company"": ""Barnes & Noble"", ""dates"": ""SEPTEMBER 2015 - DECEMBER 2016"", ""bullets"": [""Handled monetary transactions and customer services at the cash register"", ""Promoted Memberships and BN Mastercards to frequent customers"", ""Provided customer services, such as finding books, recommending readings, answering questions, and helping customers""]}]",[],[],,R_3CW1xPyNICb3Ig0,0," Adobe Photoshop, Certified, Energetic, Organized, Basic Java, C++, HTML, CSS, Proficient in Adobe InDesign, Detail-oriented, Computer Literate [{""title"": ""Student Assistant"", ""company"": ""UF Student Government"", ""dates"": ""JULY 2018 - PRESENT"", ""bullets"": [""Greets and assists visitors and directors"", ""Provides service and information to visitors, callers, and staff""]}, {""title"": ""Server"", ""company"": ""Stage 7 Karaoke & Bar"", ""dates"": ""JUNE 2017 - MARCH 2018"", ""bullets"": [""Provided customer services, such as setting up the karaoke machines and serving food"", ""Handled customer reception and monetary transactions at the cash register"", ""Organized the storage rooms, karaoke rooms, and the front bar""]}, {""title"": ""Bookseller"", ""company"": ""Barnes & Noble"", ""dates"": ""SEPTEMBER 2015 - DECEMBER 2016"", ""bullets"": [""Handled monetary transactions and customer services at the cash register"", ""Promoted Memberships and BN Mastercards to frequent customers"", ""Provided customer services, such as finding books, recommending readings, answering questions, and helping customers""]}] [] [{""school"": ""University of Florida"", ""degree"": ""College of Engineering - Digital Arts and Sciences"", ""GPA"": ""3.39"", ""year"": ""MAY 2020""}] [] "
R_3G6VYKa5zGLNe46_Catherine Weng Resume.pdf,CATHERINE LYNN WENG,catherine.weng@ufl.edu,(813) 562-9418,,,"[{""school"": ""University of Florida Honors College, Fisher School of Accounting"", ""degree"": ""Bachelor of Science in Accounting"", ""GPA"": ""4.0"", ""year"": ""May 2022""}]","[{""title"": ""Tutor"", ""company"": ""Kumon New Tampa Learning Center"", ""dates"": ""April 2017 – August 2018"", ""bullets"": [""Developed the foundations of math and essential reading and writing skills for children aged 4-6 years."", ""Tutored higher level math topics ranging from algebra to advanced calculus, enhancing problem solving skills.""]}, {""title"": ""Teaching Assistant"", ""company"": ""New Tampa Recreation Center"", ""dates"": ""October 2016 – April 2018"", ""bullets"": [""Collaborated with peers full-time to mentor children in dance and gymnastics, for 3 hours per week during the school year and 30 hours per week during the summer."", ""Managed 3 teams of 5 volunteers during summers, improving program cohesiveness.""]}]",[],[],,R_3G6VYKa5zGLNe46,0,"  [{""title"": ""Tutor"", ""company"": ""Kumon New Tampa Learning Center"", ""dates"": ""April 2017 – August 2018"", ""bullets"": [""Developed the foundations of math and essential reading and writing skills for children aged 4-6 years."", ""Tutored higher level math topics ranging from algebra to advanced calculus, enhancing problem solving skills.""]}, {""title"": ""Teaching Assistant"", ""company"": ""New Tampa Recreation Center"", ""dates"": ""October 2016 – April 2018"", ""bullets"": [""Collaborated with peers full-time to mentor children in dance and gymnastics, for 3 hours per week during the school year and 30 hours per week during the summer."", ""Managed 3 teams of 5 volunteers during summers, improving program cohesiveness.""]}] [] [{""school"": ""University of Florida Honors College, Fisher School of Accounting"", ""degree"": ""Bachelor of Science in Accounting"", ""GPA"": ""4.0"", ""year"": ""May 2022""}] [] "
"R_3GvNv3XKxVA7c0B_Resume, Spring 2019.pdf",William Blake Anderson,william.anderson@ufl.edu,239-564-7888,,"Java, C++, SQL, Rust, Kotlin, OCaml, Python, HTML, CSS, TypeScript, C#, Haskell, Gradle, JUnit","[{""school"": ""University of Florida"", ""degree"": ""B.S Computer Science"", ""GPA"": ""3.88"", ""year"": ""August 2021""}]","[{""title"": ""Ore Reviewer"", ""company"": ""SpongePowered"", ""dates"": ""January 2018 - Present"", ""bullets"": [""Minecraft modding platform for server-side plugins with over 100 contributors in 4 years"", ""Review community submissions to identify malicious code by inspecting Java bytecode"", ""Contribute to Sponge projects through issues and pull requests to further improve the software""]}]","[{""name"": ""Rhovas"", ""description"": ""Language for API design experimenting with mutability, exceptions, and dependent types. Designed language features and tooling as well as implemented compiler with Jasmine and LLVM.""}, {""name"": ""STORM"", ""description"": ""Development library for user-oriented configuration using JSON, HOCON, YAML, and XML. Integrated type serialization, validation, and error handling enforcing type safety""}, {""name"": ""TeslaPowered"", ""description"": ""Open source library for developers using Sponge with over 350 downloads and 10 projects. Provides libraries for inventory menus, translations, argument parsing, and animations""}, {""name"": ""TextVenture"", ""description"": ""Text-based adventure game library and implementation with a team of 7. Implements commands, combat, quests, data, and world systems""}]",[],"Data Structures and Algorithms, Software Engineering, Operating Systems, Database Systems, Programming Language Concepts, Computer Organizations, Enriched Physics 1, Enriched Physics 2, Enriched Physics 3, Differential Equations",R_3GvNv3XKxVA7c0B,1," Java, C++, SQL, Rust, Kotlin, OCaml, Python, HTML, CSS, TypeScript, C#, Haskell, Gradle, JUnit [{""title"": ""Ore Reviewer"", ""company"": ""SpongePowered"", ""dates"": ""January 2018 - Present"", ""bullets"": [""Minecraft modding platform for server-side plugins with over 100 contributors in 4 years"", ""Review community submissions to identify malicious code by inspecting Java bytecode"", ""Contribute to Sponge projects through issues and pull requests to further improve the software""]}] [{""name"": ""Rhovas"", ""description"": ""Language for API design experimenting with mutability, exceptions, and dependent types. Designed language features and tooling as well as implemented compiler with Jasmine and LLVM.""}, {""name"": ""STORM"", ""description"": ""Development library for user-oriented configuration using JSON, HOCON, YAML, and XML. Integrated type serialization, validation, and error handling enforcing type safety""}, {""name"": ""TeslaPowered"", ""description"": ""Open source library for developers using Sponge with over 350 downloads and 10 projects. Provides libraries for inventory menus, translations, argument parsing, and animations""}, {""name"": ""TextVenture"", ""description"": ""Text-based adventure game library and implementation with a team of 7. Implements commands, combat, quests, data, and world systems""}] [{""school"": ""University of Florida"", ""degree"": ""B.S Computer Science"", ""GPA"": ""3.88"", ""year"": ""August 2021""}] [] Data Structures and Algorithms, Software Engineering, Operating Systems, Database Systems, Programming Language Concepts, Computer Organizations, Enriched Physics 1, Enriched Physics 2, Enriched Physics 3, Differential Equations"
R_3hEFm5zeNalOo4P_Carl-Simpron_Resumé.pdf,Carl Riley T. Simpron,simpronc@ufl.edu,(863)-414-6566,Seeking an internship where my skills in software and hardware development will be applied in solving real world problems.,"C++, Python, AngularJs, Java, JavaScript, Matlab, NodeJs","[{""school"": ""University of Florida"", ""degree"": ""Bachelor’s Degree in Computer Engineering with a Minor in Physics"", ""GPA"": ""3.98"", ""year"": ""2021""}]","[{""title"": ""Video Game Development in C++ (Group Collaboration)"", ""company"": null, ""dates"": ""January 2018 – May 2018"", ""bullets"": [""Collaborated with a group of students to design a 2-D side scroller video game from scratch."", ""Designed and implemented AI for the game, with enemy AI reacting and adapting to the player’s behavior."", ""Coordinated with everyone’s code, ensuring that it was compatible with one another.""]}, {""title"": ""Data Encryption Application in C++ (Personal Project)"", ""company"": null, ""dates"": ""August 2018 – Present"", ""bullets"": [""Constructing a program that allows users to encrypt data and store it."", ""Learning cryptography and cybersecurity concepts to further improve my program."", ""End goal is to develop a web app where users can safely store their data through encryption.""]}, {""title"": ""Image Processing in Matlab (Project)"", ""company"": null, ""dates"": ""January 2018 – February 2018"", ""bullets"": [""Developed an algorithm that removed planar distortions from an image."", ""Implemented methods of interpolation to maintain clarity when an image undergoes a transformation."", ""Implemented a simple facial recognition program using the principle component analysis technique.""]}, {""title"": ""Google’s Ignite CS Program (Mentor)"", ""company"": null, ""dates"": ""April 2018 – May 2018"", ""bullets"": [""Mentored students at Oak View Middle School to facilitate an interest in computer science."", ""Utilized VEX Robotic Kits to allow mentees the ability to apply programming skills on the robots.""]}, {""title"": ""Association of Computer Engineers (Member)"", ""company"": null, ""dates"": ""August 2017 – Present"", ""bullets"": [""Engaged in workshops aimed towards improving my software related skills.""]}, {""title"": ""UF Software Engineering Club (Backend Developer)"", ""company"": null, ""dates"": ""January 2019 – Present"", ""bullets"": [""Part of a group in charge of developing the backend for a mobile app focused on school clubs and organizations.""]}]",[],[],"Programming Fundamentals 1/2, Data Structures and Algorithms, Intro to Computer Organization, Digital Logic, Intro to Software Engineering, Computer Vision",R_3hEFm5zeNalOo4P,0,"Seeking an internship where my skills in software and hardware development will be applied in solving real world problems. C++, Python, AngularJs, Java, JavaScript, Matlab, NodeJs [{""title"": ""Video Game Development in C++ (Group Collaboration)"", ""company"": null, ""dates"": ""January 2018 – May 2018"", ""bullets"": [""Collaborated with a group of students to design a 2-D side scroller video game from scratch."", ""Designed and implemented AI for the game, with enemy AI reacting and adapting to the player’s behavior."", ""Coordinated with everyone’s code, ensuring that it was compatible with one another.""]}, {""title"": ""Data Encryption Application in C++ (Personal Project)"", ""company"": null, ""dates"": ""August 2018 – Present"", ""bullets"": [""Constructing a program that allows users to encrypt data and store it."", ""Learning cryptography and cybersecurity concepts to further improve my program."", ""End goal is to develop a web app where users can safely store their data through encryption.""]}, {""title"": ""Image Processing in Matlab (Project)"", ""company"": null, ""dates"": ""January 2018 – February 2018"", ""bullets"": [""Developed an algorithm that removed planar distortions from an image."", ""Implemented methods of interpolation to maintain clarity when an image undergoes a transformation."", ""Implemented a simple facial recognition program using the principle component analysis technique.""]}, {""title"": ""Google’s Ignite CS Program (Mentor)"", ""company"": null, ""dates"": ""April 2018 – May 2018"", ""bullets"": [""Mentored students at Oak View Middle School to facilitate an interest in computer science."", ""Utilized VEX Robotic Kits to allow mentees the ability to apply programming skills on the robots.""]}, {""title"": ""Association of Computer Engineers (Member)"", ""company"": null, ""dates"": ""August 2017 – Present"", ""bullets"": [""Engaged in workshops aimed towards improving my software related skills.""]}, {""title"": ""UF Software Engineering Club (Backend Developer)"", ""company"": null, ""dates"": ""January 2019 – Present"", ""bullets"": [""Part of a group in charge of developing the backend for a mobile app focused on school clubs and organizations.""]}] [] [{""school"": ""University of Florida"", ""degree"": ""Bachelor’s Degree in Computer Engineering with a Minor in Physics"", ""GPA"": ""3.98"", ""year"": ""2021""}] [] Programming Fundamentals 1/2, Data Structures and Algorithms, Intro to Computer Organization, Digital Logic, Intro to Software Engineering, Computer Vision"
