filename,name,email,phone,summary,skills,education,experience,projects,research,relevant_classwork,Response ID,got_internship,text
R_062P3gnulqWHuYp_Resume_012319.pdf,Sara McAllister,smcallister@hmc.edu,(650) 919-4271,,"C, C++, Python, Matlab, Assembly, Bash, Haskell, Swift, Ruby on Rails, Java, React, Hack (PHP), Racket, HTML, Latex, MySQL, R, LabView","[{""school"": ""Harvey Mudd College"", ""degree"": ""Bachelor of Science in Computer Science"", ""GPA"": ""3.742"", ""year"": ""2019""}]","[{""title"": ""Tutor and Grader"", ""company"": ""Harvey Mudd College"", ""dates"": ""September 2016 - Present"", ""bullets"": [""Graded CS homework for 2-5 people a week for the four classes including data structures, computer systems"", ""Tutored about 5-30 people a week in C, Assembly, C++, Python, Java, and Racket""]}, {""title"": ""Internship"", ""company"": ""Facebook"", ""dates"": ""May 2017 - August 2017"", ""bullets"": [""Automated scheduling of developer server maintenance"", ""Developed and tested a Python library to compare user responses and coordinate with automation systems"", ""Created a React and Hack user interface to receive and store user inputs"", ""Planned and implemented three database tables to store responses from interface""]}]","[{""name"": ""High-availability NFS Server"", ""description"": ""Designed and implemented a high availability NFS active-active server on top of a two controller Pure Storage FlashArray in a team of 4, lead in areas of file systems and network partitioning solutions""}, {""name"": ""MemeFS"", ""description"": ""Created a file system in C on top of FUSE that used stenographic techniques to store user’s data in downloaded memes with two other developers, Led development on file system structure""}, {""name"": ""Can’t Stop iPhone App"", ""description"": ""Implemented traditional Can’t Stop board game as an iPhone app in Swift with the ability to play with other people or play against AIs""}]","[{""title"": ""Research Assistant, Computer Science Department, UNC Chapel Hill"", ""description"": ""Investigated and developed write-optimized dictionaries, Co-authored a paper titled “Ubiquitous Write Optimization” submitted to FAST 2019, Presented poster at Harvey Mudd’s Summer Research Poster Presentation, Engineered extended attributes on BetrFS, a write-optimized research file system, Completed theoretical and experimental analysis of node size’s effect on write-optimized directories, Sub-reviewed a paper for OSDI 2018""}, {""title"": ""Researcher, Biology Department, Harvey Mudd College"", ""description"": ""Explored the biomechanics of three-legged walking, Presented poster at 2017 American College of Sports Medicine Annual Meeting, Constructed and tested an analysis package for gait in Matlab using wearable device data, Mentored a local disadvantaged high school student on the project to provide example of college life""}]","File Systems, Algorithms, Operating Systems, Artificial Intelligence, Security, Programming Languages, Computer Systems, Data Structures/Program Development, Computability and Logic, Discrete Mathematics",R_062P3gnulqWHuYp,1," C, C++, Python, Matlab, Assembly, Bash, Haskell, Swift, Ruby on Rails, Java, React, Hack (PHP), Racket, HTML, Latex, MySQL, R, LabView [{""title"": ""Tutor and Grader"", ""company"": ""Harvey Mudd College"", ""dates"": ""September 2016 - Present"", ""bullets"": [""Graded CS homework for 2-5 people a week for the four classes including data structures, computer systems"", ""Tutored about 5-30 people a week in C, Assembly, C++, Python, Java, and Racket""]}, {""title"": ""Internship"", ""company"": ""Facebook"", ""dates"": ""May 2017 - August 2017"", ""bullets"": [""Automated scheduling of developer server maintenance"", ""Developed and tested a Python library to compare user responses and coordinate with automation systems"", ""Created a React and Hack user interface to receive and store user inputs"", ""Planned and implemented three database tables to store responses from interface""]}] [{""name"": ""High-availability NFS Server"", ""description"": ""Designed and implemented a high availability NFS active-active server on top of a two controller Pure Storage FlashArray in a team of 4, lead in areas of file systems and network partitioning solutions""}, {""name"": ""MemeFS"", ""description"": ""Created a file system in C on top of FUSE that used stenographic techniques to store user’s data in downloaded memes with two other developers, Led development on file system structure""}, {""name"": ""Can’t Stop iPhone App"", ""description"": ""Implemented traditional Can’t Stop board game as an iPhone app in Swift with the ability to play with other people or play against AIs""}] [{""school"": ""Harvey Mudd College"", ""degree"": ""Bachelor of Science in Computer Science"", ""GPA"": ""3.742"", ""year"": ""2019""}] [{""title"": ""Research Assistant, Computer Science Department, UNC Chapel Hill"", ""description"": ""Investigated and developed write-optimized dictionaries, Co-authored a paper titled “Ubiquitous Write Optimization” submitted to FAST 2019, Presented poster at Harvey Mudd’s Summer Research Poster Presentation, Engineered extended attributes on BetrFS, a write-optimized research file system, Completed theoretical and experimental analysis of node size’s effect on write-optimized directories, Sub-reviewed a paper for OSDI 2018""}, {""title"": ""Researcher, Biology Department, Harvey Mudd College"", ""description"": ""Explored the biomechanics of three-legged walking, Presented poster at 2017 American College of Sports Medicine Annual Meeting, Constructed and tested an analysis package for gait in Matlab using wearable device data, Mentored a local disadvantaged high school student on the project to provide example of college life""}] File Systems, Algorithms, Operating Systems, Artificial Intelligence, Security, Programming Languages, Computer Systems, Data Structures/Program Development, Computability and Logic, Discrete Mathematics"
R_0BQu5fWUIVXaNm9_SPRING 2019 Resume - HVL.docx,HOA V. LUU,hluu8@gatech.edu,770-853-1325,,"Java, C++, Shell Scripting (bash), MacOS, Microsoft Windows, Linux, Git, Eclipse, IntelliJ, Android Studio, English, Vietnamese","[{""school"": ""Georgia Institute of Technology"", ""degree"": ""Bachelor of Computer Science"", ""GPA"": ""3.46"", ""year"": ""2021""}, {""school"": ""University of Georgia"", ""degree"": ""Computer Science and Mathematics"", ""GPA"": ""3.84"", ""year"": ""2018""}]","[{""title"": ""Cashier"", ""company"": ""LD Nails"", ""dates"": ""Summer 2016, 2017, 2018"", ""bullets"": [""Explained the nail salon’s services to the customers"", ""Managed the daily income of the nail shop and distributed tips to the employees"", ""Welcomed and guided the customers according to the needs""]}]","[{""name"": ""Non-Profit Donation Tracking App"", ""description"": ""Designed and implemented Android app using Android Studio as part of a 5-person team. Leveraged dependency injection to allow for clean, scalable, and modular software architecture. Utilized Cloud Firestore to store user data and GitHub for application version control.""}, {""name"": ""Bash Wrapper"", ""description"": ""Built C++ wrapper to read and execute Bash commands from either standard input or a file. Utilized forking, system calls, waitpid, and I/O redirection.""}, {""name"": ""iTunes Gallery"", ""description"": ""Wrote application to display randomly swapping images from iTunes based on a keyword search. Implemented JavaFX GUI and Java backend. Included simple multithreading and web API calls.""}]",[],"Data Structures and Algorithms, Objects and Design, Systems Programming",R_0BQu5fWUIVXaNm9,0," Java, C++, Shell Scripting (bash), MacOS, Microsoft Windows, Linux, Git, Eclipse, IntelliJ, Android Studio, English, Vietnamese [{""title"": ""Cashier"", ""company"": ""LD Nails"", ""dates"": ""Summer 2016, 2017, 2018"", ""bullets"": [""Explained the nail salon’s services to the customers"", ""Managed the daily income of the nail shop and distributed tips to the employees"", ""Welcomed and guided the customers according to the needs""]}] [{""name"": ""Non-Profit Donation Tracking App"", ""description"": ""Designed and implemented Android app using Android Studio as part of a 5-person team. Leveraged dependency injection to allow for clean, scalable, and modular software architecture. Utilized Cloud Firestore to store user data and GitHub for application version control.""}, {""name"": ""Bash Wrapper"", ""description"": ""Built C++ wrapper to read and execute Bash commands from either standard input or a file. Utilized forking, system calls, waitpid, and I/O redirection.""}, {""name"": ""iTunes Gallery"", ""description"": ""Wrote application to display randomly swapping images from iTunes based on a keyword search. Implemented JavaFX GUI and Java backend. Included simple multithreading and web API calls.""}] [{""school"": ""Georgia Institute of Technology"", ""degree"": ""Bachelor of Computer Science"", ""GPA"": ""3.46"", ""year"": ""2021""}, {""school"": ""University of Georgia"", ""degree"": ""Computer Science and Mathematics"", ""GPA"": ""3.84"", ""year"": ""2018""}] [] Data Structures and Algorithms, Objects and Design, Systems Programming"
R_10CWd8wQ4nX3njO_Jesse Boakye-Donkor Resume - Copy.pdf,Jesse Boakye-Donkor,jesseboakyedonkor@yahoo.com,(813)846-7256,"To obtain a full-time job working on embedding systems that utilizes skills developed through my education, work and internship experience","Java, Python, C/C++, VHDL, Linux OS, Twi","[{""school"": ""University of Florida"", ""degree"": ""Computer Engineering Bachelor of Science"", ""GPA"": null, ""year"": ""May 2020""}]","[{""title"": ""Digital Engineering Intern"", ""company"": ""Northrop Grumman"", ""dates"": ""May 2018-August 2018"", ""bullets"": [""Created Python scripts for assessing the performance of an ASIC chip in order to increase control of independent test variables."", ""Performed reliability tests on ASIC test-boards"", ""Evaluated digital signal processing tools for designing and implementing FIR filters in VHDL to find the efficient VHDL designs to meet timing constraints.""]}, {""title"": ""Digital Engineering Intern"", ""company"": ""Northrop Grumman"", ""dates"": ""June 2017-August 2017"", ""bullets"": [""Tested different software-defined networking tools such SaltStack, Ansible, and Puppet"", ""Implemented a network emulation testbed tool known as Emulab for improving the test bench configuration process"", ""Configured servers for running different software-defined networking tools.""]}, {""title"": ""IT Hardware Specialist"", ""company"": ""Tampa Family Health Center"", ""dates"": ""May 2016-August 2016"", ""bullets"": [""Created policies for upgrading, setting up computers, dealing with call center and network downtimes"", ""Upgraded computers systems across multiple clinic sites"", ""Solved technical problems that healthcare providers and assistants encountered""]}, {""title"": ""Human Experience Research Lab"", ""company"": ""University of Florida"", ""dates"": ""January 2018 –April 2018"", ""bullets"": [""Tested Linux and other Nix operating systems for running a browser-based voting system"", ""Tested operating system virtualization for Linux machines"", ""Created a procedure for mounting virtual machines on to USB drives with persistent storage to streamline production and maintenance of the voting system.""]}, {""title"": ""Productions Crew Member"", ""company"": ""J. Wayne Reitz Union"", ""dates"": ""February 2016-August 2017"", ""bullets"": [""Arranged rooms for different events within the Reitz Union"", ""Recorded inventory of Reitz Union equipment""]}]",[],[],,R_10CWd8wQ4nX3njO,1,"To obtain a full-time job working on embedding systems that utilizes skills developed through my education, work and internship experience Java, Python, C/C++, VHDL, Linux OS, Twi [{""title"": ""Digital Engineering Intern"", ""company"": ""Northrop Grumman"", ""dates"": ""May 2018-August 2018"", ""bullets"": [""Created Python scripts for assessing the performance of an ASIC chip in order to increase control of independent test variables."", ""Performed reliability tests on ASIC test-boards"", ""Evaluated digital signal processing tools for designing and implementing FIR filters in VHDL to find the efficient VHDL designs to meet timing constraints.""]}, {""title"": ""Digital Engineering Intern"", ""company"": ""Northrop Grumman"", ""dates"": ""June 2017-August 2017"", ""bullets"": [""Tested different software-defined networking tools such SaltStack, Ansible, and Puppet"", ""Implemented a network emulation testbed tool known as Emulab for improving the test bench configuration process"", ""Configured servers for running different software-defined networking tools.""]}, {""title"": ""IT Hardware Specialist"", ""company"": ""Tampa Family Health Center"", ""dates"": ""May 2016-August 2016"", ""bullets"": [""Created policies for upgrading, setting up computers, dealing with call center and network downtimes"", ""Upgraded computers systems across multiple clinic sites"", ""Solved technical problems that healthcare providers and assistants encountered""]}, {""title"": ""Human Experience Research Lab"", ""company"": ""University of Florida"", ""dates"": ""January 2018 –April 2018"", ""bullets"": [""Tested Linux and other Nix operating systems for running a browser-based voting system"", ""Tested operating system virtualization for Linux machines"", ""Created a procedure for mounting virtual machines on to USB drives with persistent storage to streamline production and maintenance of the voting system.""]}, {""title"": ""Productions Crew Member"", ""company"": ""J. Wayne Reitz Union"", ""dates"": ""February 2016-August 2017"", ""bullets"": [""Arranged rooms for different events within the Reitz Union"", ""Recorded inventory of Reitz Union equipment""]}] [] [{""school"": ""University of Florida"", ""degree"": ""Computer Engineering Bachelor of Science"", ""GPA"": null, ""year"": ""May 2020""}] [] "
R_10Vpd1lLGe63aqu_Oliver Schmid Resume .docx,Oliver S. Schmid,oliverschmid@ufl.edu.com,+1 (727) 517-6006,,"Autodesk Inventor, Autodesk Revit, Adobe Photoshop, Adobe Illustrator, Fusion360, Java, Snap!, Microsoft Word, Microsoft Excel, Microsoft PowerPoint, Arduino","[{""school"": ""University of Florida"", ""degree"": ""Major in Digital Arts and Sciences"", ""GPA"": ""3.75"", ""year"": ""2018 – Present""}, {""school"": ""East Lake High School"", ""degree"": null, ""GPA"": ""4.03"", ""year"": null}]","[{""title"": ""Lead Counselor"", ""company"": ""Jewish Community Camp"", ""dates"": ""Jun. 2018 – August 2018"", ""bullets"": [""Led a class of over 20 campers aged between five and six years old"", ""lead counselor for sports and activities"", ""Krav Maga instructor""]}, {""title"": ""Banquet Staff"", ""company"": ""Eastlake Woodlands Country Club"", ""dates"": ""Oct. 2016 – May 2018"", ""bullets"": [""Set up banquet halls"", ""served food during the banquet"", ""cleaned and reset the banquet halls""]}, {""title"": ""Office Manager"", ""company"": ""Temple B’nai Israel"", ""dates"": ""Aug. 2012 – May 2018"", ""bullets"": [""Managed financial transactions"", ""assisted with administrative tasks and communication"", ""organized and distributed supplies""]}]",[],[],"Calculus I & II, Chemistry I, Programming I, Creativity in Context",R_10Vpd1lLGe63aqu,0," Autodesk Inventor, Autodesk Revit, Adobe Photoshop, Adobe Illustrator, Fusion360, Java, Snap!, Microsoft Word, Microsoft Excel, Microsoft PowerPoint, Arduino [{""title"": ""Lead Counselor"", ""company"": ""Jewish Community Camp"", ""dates"": ""Jun. 2018 – August 2018"", ""bullets"": [""Led a class of over 20 campers aged between five and six years old"", ""lead counselor for sports and activities"", ""Krav Maga instructor""]}, {""title"": ""Banquet Staff"", ""company"": ""Eastlake Woodlands Country Club"", ""dates"": ""Oct. 2016 – May 2018"", ""bullets"": [""Set up banquet halls"", ""served food during the banquet"", ""cleaned and reset the banquet halls""]}, {""title"": ""Office Manager"", ""company"": ""Temple B’nai Israel"", ""dates"": ""Aug. 2012 – May 2018"", ""bullets"": [""Managed financial transactions"", ""assisted with administrative tasks and communication"", ""organized and distributed supplies""]}] [] [{""school"": ""University of Florida"", ""degree"": ""Major in Digital Arts and Sciences"", ""GPA"": ""3.75"", ""year"": ""2018 – Present""}, {""school"": ""East Lake High School"", ""degree"": null, ""GPA"": ""4.03"", ""year"": null}] [] Calculus I & II, Chemistry I, Programming I, Creativity in Context"
R_12cfYuFY0QYaagh_Updated-Duc-Le-Resume.pdf,Duc Le,ducle147@gmail.com,470.326.9462,,"Java, Python, C, JavaScript, MySQL, NoSQL, MongoDB, Node.js, React.js, Redux, Express.js, Git, Unix/Linux, Android Studio, Smart Contract, Solidity","[{""school"": ""Georgia Institute of Technology"", ""degree"": ""B.S Computer Science"", ""GPA"": ""3.33"", ""year"": ""Dec 2020""}]","[{""title"": ""Software Engineer Intern"", ""company"": ""Pega System Company"", ""dates"": ""May 2019 – Aug 2019"", ""bullets"": [""Work as a Junior Developer using Java and C language""]}, {""title"": ""Programming Tutor"", ""company"": ""Georgia State University"", ""dates"": ""Jan 2018 – May 2018"", ""bullets"": [""Teach student in Object Oriented Programming and Data Structure course.""]}]","[{""name"": ""Donation Tracker"", ""description"": ""Inventory management app allows different types of users to administer donation items.""}, {""name"": ""Dev Net"", ""description"": ""A mini platform where developers can put their profile on and connect with recruiters in their industry.""}, {""name"": ""Etherity"", ""description"": ""Online auction website uses Smart Contract for biding all transactions""}]",[],"Object Oriented Programming, Data Structure and Algorithm, Object Design, Computer operating System and Programming, Database",R_12cfYuFY0QYaagh,1," Java, Python, C, JavaScript, MySQL, NoSQL, MongoDB, Node.js, React.js, Redux, Express.js, Git, Unix/Linux, Android Studio, Smart Contract, Solidity [{""title"": ""Software Engineer Intern"", ""company"": ""Pega System Company"", ""dates"": ""May 2019 – Aug 2019"", ""bullets"": [""Work as a Junior Developer using Java and C language""]}, {""title"": ""Programming Tutor"", ""company"": ""Georgia State University"", ""dates"": ""Jan 2018 – May 2018"", ""bullets"": [""Teach student in Object Oriented Programming and Data Structure course.""]}] [{""name"": ""Donation Tracker"", ""description"": ""Inventory management app allows different types of users to administer donation items.""}, {""name"": ""Dev Net"", ""description"": ""A mini platform where developers can put their profile on and connect with recruiters in their industry.""}, {""name"": ""Etherity"", ""description"": ""Online auction website uses Smart Contract for biding all transactions""}] [{""school"": ""Georgia Institute of Technology"", ""degree"": ""B.S Computer Science"", ""GPA"": ""3.33"", ""year"": ""Dec 2020""}] [] Object Oriented Programming, Data Structure and Algorithm, Object Design, Computer operating System and Programming, Database"
R_12zo89vRElT7vXY_NicholeDeeb_Resume_Final-1.pdf,Nichole Deeb,ndeeb3@gatech.edu,(404) 401-6334,,"Java, Python, JavaScript, PHP, C, C++, HTML/CSS, SQL, Git, Vagrant, Ansible & Molecule, Docker, Gradle, PostgreSQL, Jenkins, LaTeX, Android SDK, Microsoft Office, Adobe Creative Suite, AutoCAD, JUnit, Mockito, Flask, Falcon, Bootstrap, jQuery, Node.js","[{""school"": ""Georgia Institute of Technology"", ""degree"": ""Bachelor of Science in Computer Science"", ""GPA"": ""3.76"", ""year"": ""May2019""}]","[{""title"": ""Release Engineering & DevOps Intern"", ""company"": ""Virtustream"", ""dates"": ""Aug 2017 - Current"", ""bullets"": [""Developed Ansible scripts, including extensive Molecule testing through a Docker container, for auto-mateddeploymentandmanagementofwebserversforvariousinternaltools"", ""BuiltwebpageinPHPforinternalusetouploadandautomaticallyorganizelegaldocumentstocompanydatabases"", ""Facilitatedopen-sourcesoftwarecompliancebyutilizingtoolslikeBlackDuckandSonarQubetoenforcequalitygatesinJenkinspipelinesandTeamCitybuilds"", ""Wrote webpage in PHP and JavaScript to also assist in compliance by visualizing stored metadata forcurrentlyapprovedopen-sourcesoftwarepackages""]}, {""title"": ""Software Engineering Intern"", ""company"": ""Virtustream"", ""dates"": ""Summer 2017"", ""bullets"": [""Packaged unit tests into TeamCity automated build for microservice application written in Java usingJUnitandMockito,bringingtheprojectuptocompletelinecoverage"", ""Created automated integration tests with other microservices through the use of JUnit tests runningalongsidemultipleDockercontainers""]}]",[],[],"Programming: Introduction to Object Oriented Programming, Data Structures & Algorithms, Computer Organization & Programming, Introduction to Database Systems, Introduction to Information Security, Systems and Networks, Computer Networking, Projects/Teamwork: Objects and Design, Project Design & Implementation, Video Game Design",R_12zo89vRElT7vXY,1," Java, Python, JavaScript, PHP, C, C++, HTML/CSS, SQL, Git, Vagrant, Ansible & Molecule, Docker, Gradle, PostgreSQL, Jenkins, LaTeX, Android SDK, Microsoft Office, Adobe Creative Suite, AutoCAD, JUnit, Mockito, Flask, Falcon, Bootstrap, jQuery, Node.js [{""title"": ""Release Engineering & DevOps Intern"", ""company"": ""Virtustream"", ""dates"": ""Aug 2017 - Current"", ""bullets"": [""Developed Ansible scripts, including extensive Molecule testing through a Docker container, for auto-mateddeploymentandmanagementofwebserversforvariousinternaltools"", ""BuiltwebpageinPHPforinternalusetouploadandautomaticallyorganizelegaldocumentstocompanydatabases"", ""Facilitatedopen-sourcesoftwarecompliancebyutilizingtoolslikeBlackDuckandSonarQubetoenforcequalitygatesinJenkinspipelinesandTeamCitybuilds"", ""Wrote webpage in PHP and JavaScript to also assist in compliance by visualizing stored metadata forcurrentlyapprovedopen-sourcesoftwarepackages""]}, {""title"": ""Software Engineering Intern"", ""company"": ""Virtustream"", ""dates"": ""Summer 2017"", ""bullets"": [""Packaged unit tests into TeamCity automated build for microservice application written in Java usingJUnitandMockito,bringingtheprojectuptocompletelinecoverage"", ""Created automated integration tests with other microservices through the use of JUnit tests runningalongsidemultipleDockercontainers""]}] [] [{""school"": ""Georgia Institute of Technology"", ""degree"": ""Bachelor of Science in Computer Science"", ""GPA"": ""3.76"", ""year"": ""May2019""}] [] Programming: Introduction to Object Oriented Programming, Data Structures & Algorithms, Computer Organization & Programming, Introduction to Database Systems, Introduction to Information Security, Systems and Networks, Computer Networking, Projects/Teamwork: Objects and Design, Project Design & Implementation, Video Game Design"
