filename,name,email,phone,summary,skills,education,experience,projects,research,relevant_classwork,Response ID,got_internship,text
R_9yucXJsu12KOiQN_Tuan Le - Resume.pdf,Tuan Le,letuanlt09@gmail.com,(954) 478 9535,,"Java (Advanced), C++ (Intermediate), C (Beginner), MS Office (Advanced)","[{""school"": ""University of Florida"", ""degree"": ""Bachelor of Science in Computer Science"", ""GPA"": ""3.92/4.00"", ""year"": ""December 2020""}, {""school"": ""Broward College"", ""degree"": ""Associate of Art (AA)"", ""GPA"": ""3.96/4.00"", ""year"": ""May 2018""}]","[{""title"": ""Technical Internship"", ""company"": ""The Tech Toybox"", ""dates"": ""Jan 2019 - Present"", ""bullets"": [""Analyzing customer’s requirements to create a first draft for the product"", ""Evaluating thoroughly and predicting all possible outcomes of the first draft to modify and improve it"", ""Building the first product by using CAD to design, CNC Laser Cutter and 3D printer to manufacture"", ""Testing and adjusting the test version before mass producing""]}, {""title"": ""Math Tutor"", ""company"": ""Math Lab"", ""dates"": ""Jan 2017 – May 2017"", ""bullets"": [""Quickly reviewed students’ works to assist in improving their skills and instructed them how to fix their problems"", ""Broke down complicated problems to many small parts when explaining new materials for students to help them understand and solve the problems""]}, {""title"": ""Technical Support"", ""company"": ""Aleks Lab"", ""dates"": ""Jan 2017 – May 2017"", ""bullets"": [""Instructed new students step by step to do the initial setting for their labs"", ""Helped students when they have questions about math problems while practicing""]}]",[],[],,R_9yucXJsu12KOiQN,0," Java (Advanced), C++ (Intermediate), C (Beginner), MS Office (Advanced) [{""title"": ""Technical Internship"", ""company"": ""The Tech Toybox"", ""dates"": ""Jan 2019 - Present"", ""bullets"": [""Analyzing customer’s requirements to create a first draft for the product"", ""Evaluating thoroughly and predicting all possible outcomes of the first draft to modify and improve it"", ""Building the first product by using CAD to design, CNC Laser Cutter and 3D printer to manufacture"", ""Testing and adjusting the test version before mass producing""]}, {""title"": ""Math Tutor"", ""company"": ""Math Lab"", ""dates"": ""Jan 2017 – May 2017"", ""bullets"": [""Quickly reviewed students’ works to assist in improving their skills and instructed them how to fix their problems"", ""Broke down complicated problems to many small parts when explaining new materials for students to help them understand and solve the problems""]}, {""title"": ""Technical Support"", ""company"": ""Aleks Lab"", ""dates"": ""Jan 2017 – May 2017"", ""bullets"": [""Instructed new students step by step to do the initial setting for their labs"", ""Helped students when they have questions about math problems while practicing""]}] [] [{""school"": ""University of Florida"", ""degree"": ""Bachelor of Science in Computer Science"", ""GPA"": ""3.92/4.00"", ""year"": ""December 2020""}, {""school"": ""Broward College"", ""degree"": ""Associate of Art (AA)"", ""GPA"": ""3.96/4.00"", ""year"": ""May 2018""}] [] "
R_265fKwyGfZO6VcS_My Resume  - most updated 2 - cdw.docx,Janice Ng,Janiceng445@outlook.com,(772) 418-4466,,"C++, Java, C#, HTML, CSS, SQL, Photoshop, Blender, 3ds Maya, Unity, Communication, Leadership, Teamwork, Adaptability, Creativity, Time management, Quick learner","[{""school"": ""University of Florida"", ""degree"": ""B.S. in Computer Science"", ""GPA"": ""3.86"", ""year"": null}, {""school"": ""University of Florida"", ""degree"": ""Minor in Digital Arts & Sciences"", ""GPA"": ""3.86"", ""year"": null}, {""school"": ""Indian River State College"", ""degree"": ""Computer Programming Specialist"", ""GPA"": null, ""year"": ""2017""}, {""school"": ""Indian River State College"", ""degree"": ""A.A. in Computer Science"", ""GPA"": ""3.96"", ""year"": ""2015""}]","[{""title"": ""Independent Contractor"", ""company"": ""iRemedy Healthcare, Inc."", ""dates"": ""(August 2017-Present)"", ""bullets"": [""Create content pages on Magento platform using html and css"", ""Web design and implement WordPress site using languages: html, php, and css"", ""Design mockups and implemented prototype interfaces for new web apps"", ""Efficiently work directly under the CEO and a group of directors"", ""Micromanage multiple assignments and projects within short time periods"", ""Utilize problem solving skills offer creative solutions to resolve issues and concerns"", ""Test and debug functionalities in new site implementations"", ""Post new articles on corporate site"", ""Adjust and edit provided graphics using Adobe Photoshop per instruction"", ""Train colleagues in technology and software use"", ""Ability to work remotely and maintain communication""]}, {""title"": ""Technical Support Assistant"", ""company"": ""iRemedy Healthcare, Inc."", ""dates"": ""(December 2016-August 2017)"", ""bullets"": []}]","[{""name"": ""Game Jam 2019"", ""description"": ""Collaborated in a team of three to create a game in 48 hours. Planned and assisted with design of 2D platform game. Coded with C# in Unity.""}]",[],,R_265fKwyGfZO6VcS,0," C++, Java, C#, HTML, CSS, SQL, Photoshop, Blender, 3ds Maya, Unity, Communication, Leadership, Teamwork, Adaptability, Creativity, Time management, Quick learner [{""title"": ""Independent Contractor"", ""company"": ""iRemedy Healthcare, Inc."", ""dates"": ""(August 2017-Present)"", ""bullets"": [""Create content pages on Magento platform using html and css"", ""Web design and implement WordPress site using languages: html, php, and css"", ""Design mockups and implemented prototype interfaces for new web apps"", ""Efficiently work directly under the CEO and a group of directors"", ""Micromanage multiple assignments and projects within short time periods"", ""Utilize problem solving skills offer creative solutions to resolve issues and concerns"", ""Test and debug functionalities in new site implementations"", ""Post new articles on corporate site"", ""Adjust and edit provided graphics using Adobe Photoshop per instruction"", ""Train colleagues in technology and software use"", ""Ability to work remotely and maintain communication""]}, {""title"": ""Technical Support Assistant"", ""company"": ""iRemedy Healthcare, Inc."", ""dates"": ""(December 2016-August 2017)"", ""bullets"": []}] [{""name"": ""Game Jam 2019"", ""description"": ""Collaborated in a team of three to create a game in 48 hours. Planned and assisted with design of 2D platform game. Coded with C# in Unity.""}] [{""school"": ""University of Florida"", ""degree"": ""B.S. in Computer Science"", ""GPA"": ""3.86"", ""year"": null}, {""school"": ""University of Florida"", ""degree"": ""Minor in Digital Arts & Sciences"", ""GPA"": ""3.86"", ""year"": null}, {""school"": ""Indian River State College"", ""degree"": ""Computer Programming Specialist"", ""GPA"": null, ""year"": ""2017""}, {""school"": ""Indian River State College"", ""degree"": ""A.A. in Computer Science"", ""GPA"": ""3.96"", ""year"": ""2015""}] [] "
R_323CfTMmIRISkke_Nicholas Alvarez Hardware Resume.pdf,Nicholas A. Alvarez,nicholasaalvarez@ufl.edu,(678) 925-4868,"Seeking to contribute to the success of a company and industry by leveraging my computer engineering skills, experience, and education.","Mips assembly, C++, C, Java, Digital circuit design/synthesis, Quartus, Vivado, LT Spice, Matlab, VHDL, Model Sim, Web development, HTML, CSS, JavaScript, Gaming Engines – Unity, Communication, Strong interpersonal skills, Embedded Programming – Atmel Processor, Microsoft – Word, PowerPoint, Excel, Outlook, Languages – Conversational in Spanish, Project management skills, Leadership, Strong leadership skills","[{""school"": ""University of Florida"", ""degree"": ""Bachelor of Science, Computer Engineering"", ""GPA"": null, ""year"": ""May 2019""}]","[{""title"": ""FPGA Researcher"", ""company"": ""University of Florida"", ""dates"": ""May 2018 – August 2018"", ""bullets"": [""Applications FPGAs are useful for, focused on the usability of FPGA, and FPGA use for data center applications."", ""FPGAs being used as accelerators to boost compute power of individual server nodes to improve overall power efficiency.""]}, {""title"": ""Intern"", ""company"": ""R-Squared Computing"", ""dates"": ""June 2016 – August 2016"", ""bullets"": [""Created Ethernet cables and installed routers, configured business computers, and assisted in trouble shooting network issues that different companies were having within their work environment.""]}]","[{""name"": ""Fibonacci Calculator"", ""description"": ""Created an FSM+D and FSMD of a Fibonacci calculator in VHDL, synthesized using Vivado to test through the University of Florida servers on a Zed board FPGA.""}, {""name"": ""Synchronous Communication"", ""description"": ""Integrated an internal UART on an Atmel processor to communicate with an on-board accelerometer to transfer X, Y, and Z plot data using SPI.""}, {""name"": ""Mips Processor"", ""description"": ""Coded a MIPS processor in VHDL that used a structural architecture that ran programs using the basic instruction set for MIPS which supported the three instruction formats (R-Type, I-Type, J-Type).""}, {""name"": ""ALU"", ""description"": ""Generic width ALU designed using a behavioral architecture for functions like addition, subtraction, multiplication, XOR, NOR, OR, and shifts. Devised a test bench to test the functionality of the ALU to assert outputs were correct.""}, {""name"": ""VGA Interfacing"", ""description"": ""Developed VHDL code to take a 25 MHZ pixel clock to generate all the proper signals required to interface with a VGA out port using a standard VGA cable. Using any image, created a mif file for the image storing it into a ROM then reading from the rom to display the image onto a monitor.""}]",[],,R_323CfTMmIRISkke,0,"Seeking to contribute to the success of a company and industry by leveraging my computer engineering skills, experience, and education. Mips assembly, C++, C, Java, Digital circuit design/synthesis, Quartus, Vivado, LT Spice, Matlab, VHDL, Model Sim, Web development, HTML, CSS, JavaScript, Gaming Engines – Unity, Communication, Strong interpersonal skills, Embedded Programming – Atmel Processor, Microsoft – Word, PowerPoint, Excel, Outlook, Languages – Conversational in Spanish, Project management skills, Leadership, Strong leadership skills [{""title"": ""FPGA Researcher"", ""company"": ""University of Florida"", ""dates"": ""May 2018 – August 2018"", ""bullets"": [""Applications FPGAs are useful for, focused on the usability of FPGA, and FPGA use for data center applications."", ""FPGAs being used as accelerators to boost compute power of individual server nodes to improve overall power efficiency.""]}, {""title"": ""Intern"", ""company"": ""R-Squared Computing"", ""dates"": ""June 2016 – August 2016"", ""bullets"": [""Created Ethernet cables and installed routers, configured business computers, and assisted in trouble shooting network issues that different companies were having within their work environment.""]}] [{""name"": ""Fibonacci Calculator"", ""description"": ""Created an FSM+D and FSMD of a Fibonacci calculator in VHDL, synthesized using Vivado to test through the University of Florida servers on a Zed board FPGA.""}, {""name"": ""Synchronous Communication"", ""description"": ""Integrated an internal UART on an Atmel processor to communicate with an on-board accelerometer to transfer X, Y, and Z plot data using SPI.""}, {""name"": ""Mips Processor"", ""description"": ""Coded a MIPS processor in VHDL that used a structural architecture that ran programs using the basic instruction set for MIPS which supported the three instruction formats (R-Type, I-Type, J-Type).""}, {""name"": ""ALU"", ""description"": ""Generic width ALU designed using a behavioral architecture for functions like addition, subtraction, multiplication, XOR, NOR, OR, and shifts. Devised a test bench to test the functionality of the ALU to assert outputs were correct.""}, {""name"": ""VGA Interfacing"", ""description"": ""Developed VHDL code to take a 25 MHZ pixel clock to generate all the proper signals required to interface with a VGA out port using a standard VGA cable. Using any image, created a mif file for the image storing it into a ROM then reading from the rom to display the image onto a monitor.""}] [{""school"": ""University of Florida"", ""degree"": ""Bachelor of Science, Computer Engineering"", ""GPA"": null, ""year"": ""May 2019""}] [] "
R_300HhImYyWrFIuQ_Nabid Resume 2019.pdf,NABID FARVEZ,nfarvez3@gatech.edu,(678) 549-8013,,"Python, Java, C#, HTML & CSS, MySQL, Unity Game Engine, Autodesk Inventor, SolidWorks, Blender, Google SketchUp, Microsoft Office, Adobe Premiere/Final Cut Pro, English, Bengali, Spanish","[{""school"": ""GEORGIA INSTITUTE OF TECHNOLOGY"", ""degree"": ""Bachelor of Science in Computer Science"", ""GPA"": ""4.0"", ""year"": ""Spring 2022""}]","[{""title"": ""Undergraduate Research Assistant"", ""company"": ""BIOMEDICAL MICROSYSTEMS LAB"", ""dates"": ""Spring 2019 – Present"", ""bullets"": [""Currently optimizing fluorescence microscope for auto-focus scanning to improve lab workflow of array analysis to detect cancer cells""]}, {""title"": ""Intern"", ""company"": ""CISCO SYSTEMS"", ""dates"": ""Summer 2017"", ""bullets"": [""Designed Python script to read text files and feed hex values into FPGA device"", ""Attended meetings with Cisco stakeholders including Georgia Department of Health""]}, {""title"": ""STEM Extern"", ""company"": ""CISCO SYSTEMS"", ""dates"": ""Summer 2016"", ""bullets"": [""Competed in Smart & Connected Communities capstone research project (2nd Place)"", ""Trained in basics of product failure analysis equipment as material science lab assistant"", ""Attended workshops on public speaking, project management, and visual storytelling""]}]","[{""name"": ""Hospital Rover"", ""description"": null}, {""name"": ""Dare to Venture: Escape the Frog"", ""description"": null}]",[],,R_300HhImYyWrFIuQ,1," Python, Java, C#, HTML & CSS, MySQL, Unity Game Engine, Autodesk Inventor, SolidWorks, Blender, Google SketchUp, Microsoft Office, Adobe Premiere/Final Cut Pro, English, Bengali, Spanish [{""title"": ""Undergraduate Research Assistant"", ""company"": ""BIOMEDICAL MICROSYSTEMS LAB"", ""dates"": ""Spring 2019 – Present"", ""bullets"": [""Currently optimizing fluorescence microscope for auto-focus scanning to improve lab workflow of array analysis to detect cancer cells""]}, {""title"": ""Intern"", ""company"": ""CISCO SYSTEMS"", ""dates"": ""Summer 2017"", ""bullets"": [""Designed Python script to read text files and feed hex values into FPGA device"", ""Attended meetings with Cisco stakeholders including Georgia Department of Health""]}, {""title"": ""STEM Extern"", ""company"": ""CISCO SYSTEMS"", ""dates"": ""Summer 2016"", ""bullets"": [""Competed in Smart & Connected Communities capstone research project (2nd Place)"", ""Trained in basics of product failure analysis equipment as material science lab assistant"", ""Attended workshops on public speaking, project management, and visual storytelling""]}] [{""name"": ""Hospital Rover"", ""description"": null}, {""name"": ""Dare to Venture: Escape the Frog"", ""description"": null}] [{""school"": ""GEORGIA INSTITUTE OF TECHNOLOGY"", ""degree"": ""Bachelor of Science in Computer Science"", ""GPA"": ""4.0"", ""year"": ""Spring 2022""}] [] "
R_268YHbOCwjF4jX8_NatalieDannerResume.pdf,Natalie Danner,natalie.danner97@gmail.com,(727)504-3722,,"Solidworks, VB.Net, Java, Microsoft Excel VBA, Microsoft Word, PowerPoint","[{""school"": ""University of Florida"", ""degree"": ""Bachelor of Science in Industrial and Systems Engineering"", ""GPA"": ""3.33"", ""year"": ""Spring 2021""}]","[{""title"": ""Hostess"", ""company"": ""Hook’s Sushi Bar and Thai Restaurant"", ""dates"": ""August 2015- May2016"", ""bullets"": [""Managed the flow of restaurant activity to accommodate guests’ needs while maintaining equal opportunity for the serving staff"", ""Performed fast pace problem solving in unexpected situations to minimize complications""]}, {""title"": ""Waitstaff"", ""company"": ""Cacciatore Catering"", ""dates"": ""August 2018–Present"", ""bullets"": [""Executed the tasks of an assigned role while proactively assisting co-workers"", ""Adapted to constantly changing environments by effectively communicating with upper level management to establish goals and ensure the success of each event"", ""Exhibited a high level of professionalism towards 300+ guests at events hosted by the President of the University of Florida""]}]","[{""name"": ""Professional Communication for Engineers"", ""description"": """"}, {""name"": ""Computer Aided Graphing and Design (with Solidworks)"", ""description"": """"}]",[],,R_268YHbOCwjF4jX8,1," Solidworks, VB.Net, Java, Microsoft Excel VBA, Microsoft Word, PowerPoint [{""title"": ""Hostess"", ""company"": ""Hook’s Sushi Bar and Thai Restaurant"", ""dates"": ""August 2015- May2016"", ""bullets"": [""Managed the flow of restaurant activity to accommodate guests’ needs while maintaining equal opportunity for the serving staff"", ""Performed fast pace problem solving in unexpected situations to minimize complications""]}, {""title"": ""Waitstaff"", ""company"": ""Cacciatore Catering"", ""dates"": ""August 2018–Present"", ""bullets"": [""Executed the tasks of an assigned role while proactively assisting co-workers"", ""Adapted to constantly changing environments by effectively communicating with upper level management to establish goals and ensure the success of each event"", ""Exhibited a high level of professionalism towards 300+ guests at events hosted by the President of the University of Florida""]}] [{""name"": ""Professional Communication for Engineers"", ""description"": """"}, {""name"": ""Computer Aided Graphing and Design (with Solidworks)"", ""description"": """"}] [{""school"": ""University of Florida"", ""degree"": ""Bachelor of Science in Industrial and Systems Engineering"", ""GPA"": ""3.33"", ""year"": ""Spring 2021""}] [] "
R_32QSXbmy9nTfTWs_Resume (2).pdf,Michael Joseph O’Connell,michaeljoconnell@ufl.edu,(904) 629-9221,,"C#, C++, C, Java, Python, JavaScript, CSS, HTML, MEAN stack, MATLAB, ARM, Unity, Photoshop, Oculus, Google VR, Maya, iOS, Android Studio, GitHub","[{""school"": ""University of Florida"", ""degree"": ""BS in Computer Science, Minor in Digital Arts And Sciences"", ""GPA"": ""3.49"", ""year"": """"}]","[{""title"": ""Scrum Master and Freelancer"", ""company"": ""VR Research Lab at Penn State University"", ""dates"": ""September 2018 - Present"", ""bullets"": [""Crafted the world’s first persuasive user-centered virtual reality interactive narrative addressing college students’ apathy towards the influenza vaccine using Unity, C#, and Oculus."", ""Lead 4 person team in a scrum development process, including storyboarding, scripting, strategic implementation of body transfer, and focus group testing."", ""Upon completion, I continued work as an independent freelancer to develop new alternate versions for a research study analyzing types of persuasion in VR.""]}, {""title"": ""Game Producer"", ""company"": ""Gator Game Jam Competition"", ""dates"": ""January 2019"", ""bullets"": [""Lead a small 5 person interdisciplinary team to focus on creating an engaging VR experience with artistic mini games using Unity, Photoshop, Maya, Google VR, Android, and C#. Developed VR interaction, gameplay, branching dialogue, multiple endings.""]}, {""title"": ""Producer"", ""company"": ""Swamphacks V"", ""dates"": ""January 2019"", ""bullets"": [""Lead a team of 3 to create a VR application with Unity and Oculus to bring about empathy and inspire donations to charitable organizations such as the Salvation Army to combat food deserts. Gamified trying to find affordable healthy food. Developed VR interaction, gameplay, and messaging.""]}, {""title"": ""Mentor"", ""company"": ""Google igniteCS"", ""dates"": ""April - May 2018"", ""bullets"": [""Mentored a group of three 6th graders, assisted in teaching a curriculum to enrich critical thinking, problem solving, and the debugging experience for Vex Robotics and RobotC at Oak View Middle School.""]}]","[{""name"": ""Smartphone Sports"", ""description"": ""Created a completely original independent mobile phone game using Unity, C#, and Photoshop for iOS and Android. Designed charming characters, a comedic narrative, and engaging gameplay focused around unique device properties such as the touchscreen and gyroscope. Conducted target audience testing with 50 individuals ages 8-50 and iterated project based off of feedback and collected data from playthroughs.""}]",[],"Data Structures, Software Engineering, Database Systems, Operating Systems, VR for Social Good, Computer Organization, Digital Logic, Game Development",R_32QSXbmy9nTfTWs,0," C#, C++, C, Java, Python, JavaScript, CSS, HTML, MEAN stack, MATLAB, ARM, Unity, Photoshop, Oculus, Google VR, Maya, iOS, Android Studio, GitHub [{""title"": ""Scrum Master and Freelancer"", ""company"": ""VR Research Lab at Penn State University"", ""dates"": ""September 2018 - Present"", ""bullets"": [""Crafted the world’s first persuasive user-centered virtual reality interactive narrative addressing college students’ apathy towards the influenza vaccine using Unity, C#, and Oculus."", ""Lead 4 person team in a scrum development process, including storyboarding, scripting, strategic implementation of body transfer, and focus group testing."", ""Upon completion, I continued work as an independent freelancer to develop new alternate versions for a research study analyzing types of persuasion in VR.""]}, {""title"": ""Game Producer"", ""company"": ""Gator Game Jam Competition"", ""dates"": ""January 2019"", ""bullets"": [""Lead a small 5 person interdisciplinary team to focus on creating an engaging VR experience with artistic mini games using Unity, Photoshop, Maya, Google VR, Android, and C#. Developed VR interaction, gameplay, branching dialogue, multiple endings.""]}, {""title"": ""Producer"", ""company"": ""Swamphacks V"", ""dates"": ""January 2019"", ""bullets"": [""Lead a team of 3 to create a VR application with Unity and Oculus to bring about empathy and inspire donations to charitable organizations such as the Salvation Army to combat food deserts. Gamified trying to find affordable healthy food. Developed VR interaction, gameplay, and messaging.""]}, {""title"": ""Mentor"", ""company"": ""Google igniteCS"", ""dates"": ""April - May 2018"", ""bullets"": [""Mentored a group of three 6th graders, assisted in teaching a curriculum to enrich critical thinking, problem solving, and the debugging experience for Vex Robotics and RobotC at Oak View Middle School.""]}] [{""name"": ""Smartphone Sports"", ""description"": ""Created a completely original independent mobile phone game using Unity, C#, and Photoshop for iOS and Android. Designed charming characters, a comedic narrative, and engaging gameplay focused around unique device properties such as the touchscreen and gyroscope. Conducted target audience testing with 50 individuals ages 8-50 and iterated project based off of feedback and collected data from playthroughs.""}] [{""school"": ""University of Florida"", ""degree"": ""BS in Computer Science, Minor in Digital Arts And Sciences"", ""GPA"": ""3.49"", ""year"": """"}] [] Data Structures, Software Engineering, Database Systems, Operating Systems, VR for Social Good, Computer Organization, Digital Logic, Game Development"
R_725VXCJVeeKLlXr_Resume 4-3.docx,"Ward, Jiquis J.",wardjiquis@ufl.edu,229-233-2344,To graduate from University of Florida with a degree in Digital Art & Science.,"communication skills, working with others, Microsoft 365, coding, Graphic Design","[{""school"": ""Thomas County Central High School"", ""degree"": null, ""GPA"": null, ""year"": null}, {""school"": ""University of Florida"", ""degree"": null, ""GPA"": ""3.8"", ""year"": null}]","[{""title"": ""President"", ""company"": ""Thomasville Kappa League Program"", ""dates"": null, ""bullets"": []}, {""title"": ""Leader"", ""company"": ""Forensic Team at TCCHS"", ""dates"": ""two years"", ""bullets"": []}, {""title"": null, ""company"": ""International Association for Identification"", ""dates"": ""36 Hours of Internship"", ""bullets"": []}, {""title"": null, ""company"": ""Chick-Fil-A Leader Academy"", ""dates"": null, ""bullets"": []}]",[],[],,R_725VXCJVeeKLlXr,0,"To graduate from University of Florida with a degree in Digital Art & Science. communication skills, working with others, Microsoft 365, coding, Graphic Design [{""title"": ""President"", ""company"": ""Thomasville Kappa League Program"", ""dates"": null, ""bullets"": []}, {""title"": ""Leader"", ""company"": ""Forensic Team at TCCHS"", ""dates"": ""two years"", ""bullets"": []}, {""title"": null, ""company"": ""International Association for Identification"", ""dates"": ""36 Hours of Internship"", ""bullets"": []}, {""title"": null, ""company"": ""Chick-Fil-A Leader Academy"", ""dates"": null, ""bullets"": []}] [] [{""school"": ""Thomas County Central High School"", ""degree"": null, ""GPA"": null, ""year"": null}, {""school"": ""University of Florida"", ""degree"": null, ""GPA"": ""3.8"", ""year"": null}] [] "
